filename|text
segment_2218.wav|Գիշերվա կեսին նա արթնացավ․ օջախում կրակը մլմլում էր, թզուկներն ու Հենդալֆը հանդարտ շնչում էին, ըստ երևույթին խոր քնած էին
segment_2219.wav|Լուսինը բարձրացել էր և երդիկից ներս էր նայում
segment_2220.wav|Հատակին լուսնի շողքն էր ընկած
segment_2221.wav|Դրսից փնթփնթոց և ինչ֊որ աղմուկ էր լսվում, ասես դռան ետևում մի մեծ գազան էր շուռումուռ գալիս
segment_2222.wav|Բիլբոն մտածեց․ չլինի՞ Բեորնն է այնտեղ արջի կերպարանք ստացել, չլինի՞ թե գա իրենց ուտի
segment_2223.wav|Հետո նա փաթաթվեց վերմակի մեջ և, չնայած իր տագնապներին, նորից քնեց
segment_2224.wav|Երբ առավոտյան վերջնականապես արթանցավ, արդեն բավական ուշ էր
segment_2225.wav|Թզուկներից մեկը սայթաքեց և, Բիլբոյին կպչելով, փռվեց հատակին
segment_2226.wav|Դա Բոֆուրն էր։ Երբ Բիլբոն աչքերը բացեց, նա փնթփնթում էր ու ջղայնանում․  ― Վեր կաց, ալարկոտ, թե չա նախաճաշ չի հասնի
segment_2227.wav|Բիլբոն արագ վեր թռավ տեղից, նախաճա՞շ
segment_2228.wav|― Գոռաց նա,― որտե՞ղ է
segment_2229.wav|― Մեծ մասը մեր ստամոքսներում է,― արձագանքեցին նախասենյակում ետ ու առաջ քայլող թզուկները
segment_2230.wav|― Իսկ այն, ինչ մնացել է, պատշգամբում է։ Մենք արևածագից Բեորնին ենք փնտրում և չենք կարողանում գտնել
segment_2231.wav|Դրա փոխարեն պատշգամբում նախաճաշի համար բացված սեղան գտանք
segment_2232.wav|― Իսկ Հենդալֆն ո՞ւր է,― հարցրեց Բիլբոն՝ պատշգամբ դուրս թռչելով
segment_2233.wav|― Ինչ֊որ տեղ թրև է գալիս,― պատասխանեցին նրան
segment_2234.wav|Կախարդը մինչև երեկո չվերադարձավ
segment_2235.wav|Միայն մայրամուտին նա մտավ այն սենյակը, որտեղ ընթրում էին հոբիտն ու թզուկները
segment_2236.wav|Նորից մատուցում էին հրաշալի գազանները
segment_2237.wav|Նախորդ երեկոյից ոչ Բեորնի ձայնն էր լսվում, ոչ էլ ինքն էր երևում, իսկ թզուկները տարակուսանքի մեջ էին
segment_2238.wav|― Ո՞ւր է մեր հյուրընկալը։ Ո՞ւր էիք անհետացել ամբողջ օրը,― Հենդալֆի երևալուն պես գոռացին բոլորը
segment_2239.wav|― Հարցերին կպատասխանեմ հերթով, այն էլ ընթրիքից հետո
segment_2240.wav|Առավոտից բերանս մի կտոր բան չեմ դրել
segment_2241.wav|Վերջապես Հենդալֆը ետ հրեց ափսեն ու սափորը (նա ամբողջ երկու հաց կերավ, դրանց վրա կարագ, մեղր ու կաթնասեր քսելով, խմեց համարյա մեկ լիտր մեղրահյութ) և ծխամորճը հանեց
segment_2242.wav|― Նախ կպատասխանեմ երկրորդ հարցին,― ասաց նա
segment_2243.wav|― Աստված իմ… Այս շինությունը ստեղծված է ծխի օղակներ բաց թողնելու համար…  Նրանք դեռ երկար ժամանակ ոչինչ չէին կարողանում դուրս քաշել Հենդալֆից, որովհետև նա տարված էր օղակներ բաց թողնելով․ նրա օղակները սավառնեցին սյուների շուրջը, փոփոխեցին ձևերն ու գույները, վերջապես մեկը մյուսի հետևից ընկնելով՝ դուրս թռան երդիկից
segment_2244.wav|― Ես արջերի հետքերն էին տնտղում,― ի վերջո պատասխանեց Հենդալֆը
segment_2245.wav|― Այս գիշեր այստեղ, ինչպես երևում է, արջերի բազմություն է հյուրընկալվել
segment_2246.wav|Ես իսկույն հասկացա, որ Բեորնը մենակ չէր կարող այդքան հետքեր թողնել, ըստ որում ամենատարբեր չափերի
segment_2247.wav|Նույնիսկ կասեի, որ ամբողջ գիշերը, մինչև լույս այստեղ արջեր են պար եկել՝ փոքր ու խոշոր, միջահասակ ու հսկա
segment_2248.wav|Նրանք հավաքվել են բոլոր կողմերից, բացի մեկից․ ոչ ոք չի եկել արևմուտքից, լեռներից
segment_2249.wav|Եվ այդ կողմ գնում են միայն մեկ արջի հետքերը
segment_2250.wav|Ես հետքերով հասա մինչև Կարրոկ ժայռը, որտեղ դրանք իջան գետը, իսկ մյուս ափը չանցա՝ գետն այնտեղ չափազանց խոր է և հոսանքն էլ ուժեղ
segment_2251.wav|Այն կողմում հետքերը մտնում էին ուղիղ սոճիների անտառը՝ Մառախլապատ Լեռների արևելյան լանջերին, որտեղ տեղի ունեցավ մեր սիրազեղ հանդիպումը վարգերի հետ
segment_2252.wav|Այսպիսով, ես, թվում է, պատասխանեցի նաև առաջին հարցին,― վերջացրեց Հենդալֆը
segment_2253.wav|Բիլբոյին թվաց, որ ինքը հասկանում է, թե խոսքը դեպի ուր է ծռում կախարդը
segment_2254.wav|― Իսկ ի՞նչ կանենք, եթե նա այստեղ բերի վարգերին ու գոբլիններին,― բացականչեց Բիլբոն
segment_2255.wav|― Բոլորիս կկոտորեն։ Չէ՞ որ դուք առաջ ասում էիք, թե Բեորնը նարնց հետ բարեկամություն չի անում
segment_2256.wav|― Հետո ի՞նչ։ Հիմա էլ եմ ասում
segment_2257.wav|Հիմարություններ դուրս մի՛ տուր
segment_2258.wav|Ավելի լավ է գնաս քնես, թե չէ գլուխդ արդեն չի աշխատում
segment_2259.wav|Հոբիտն իսկապես էլ իրեն ջախջախված էր զգում, և նրան մնում էր միայն պառկել քնել
segment_2260.wav|նա քնեց թզուկների երգի տակ
segment_2261.wav|Ննջելով՝ Բիլբոն դարձյալ մտածում էր Բեորնի մասին․ նա երազում տեսավ, որ հարյուրավոր սև արջեր, շուրջպար բռնած, դանդաղ ու ծանրորեն պտտվում են լուսնի լույսի տակ
segment_2262.wav|Նա արթնացավ կեսգիշերին, երբ բոլորը քնած էին, դռան ետևից լսեց նույն շրշոցը, ֆսֆսոցն ու մռթմռթոցը, ինչ և նախորդ գիշերը
segment_2263.wav|Առավոտյան նրանց արթնացրեց Բեորնը
segment_2264.wav|― Ա՜, ուրեմն դուք դեռ այստեղ եք,― ասաց նա՝ հոբիտի օձիքից բռնած բարձրացնելով ու ծիծաղելով
segment_2265.wav|― Տեսնում եմ, վարգերը, գոբլինները ու չար արջերը քեզ դեռ չեն կերել
segment_2266.wav|― Եվ ամենաանհարգալի ձևով մատով բզեց միստր Բեգինսի փորը․― Մեր գնդլիկը լավ էլ տռզել է կաթնահացով ու մեղրով
segment_2267.wav|Գնանք էլի ավելացնենք։ Եվ բոլորը նրա հետ գնացին նախաճաշելու
segment_2268.wav|Այս անգամ Բեորնը հիանալի տրամադրության մեջ էր և շատ ծիծաղեցրեց նրանց զանազան զվարճալի պատմություններով
segment_2269.wav|Հյուրերը ստիպված չեղան երկար գլուխ ջարդել, թե ուր էր նա անհետացել և ինչու է այդպես սիրալիր․ շուտով նա ինքը պատմեց ամեն ինչ
segment_2270.wav|Բեորնը արշավ էր կատարել գետից այն կողմ, դեպի լեռները, և հարկ է նկատել, որ շատ արագ էր գործը գլուխ բերել
segment_2271.wav|Լինելով գայելրի այրված բացատում՝ նա համոզվել էր, որ համենայն դեպս թզուկների պատմածի մի մասը ճշմարտություն է
segment_2272.wav|Նա անտառում մի վարգ ու գոբլին էր բռնել և նրանցից իմացել, որ գոբլինների պարեկները վարգերի հետ միասին դեռ թզուկներին են փնտրում
segment_2273.wav|Նրանց խիստ կատաղեցրել է Գերագույն Գոբլինի մահը և գայլերի առաջնորդի խանձված քիթը, ինչպս նաև շատ գլխավոր վարգերի կործանումը կախարդի սարքած հրդեհից
segment_2274.wav|Նարքն հարձակումներ էին կազմակերպում մառախլապատ Լեռների մոտակա հողերի վրա, որպեսզի բռնեն թզուկներին և վրեժխնդիր լինեն մարդկանցից ու շրջակայքի բոլոր էակներից, ովքեր, ինչպես նրաքն կասկածում էին, պատսպարում են թզուկներին
segment_2275.wav|― Ձեր պատմությունը հրաշալի էր,― եզրակացրեց Բեորնը,― բայց հիմա, երբ ես համոզվել եմ նրա ճշմարությանը, այն ավելի քան սրտովս է
segment_2276.wav|Ես ձեզ առաջարկում եմ ցանկացած օգնությունը, որ իմ ուժը կպատի
segment_2277.wav|Դուք էլ որ ինձ նման ապրեիք Սև Անտառի ծայրին, ոչ մեկի խոսքին չէիք հավատա
segment_2278.wav|Այս դեպքից հետո ես լավ կվերաբերվեմ բոլոր թզուկներին
segment_2279.wav|Հո քիչ բան չէ, սպանել են Գերագույն Գոբլինին, հենց իրեն՝ Գերագույն Գոբլինին
segment_2280.wav|― Եվ նա ծիծաղեց դաժան ծիծաղով
segment_2281.wav|― Իսկ դուք ի՞նչ արեցիք գոբլինին ու վարգին,― հետաքրքրվեց Բիլբոն
segment_2282.wav|― Եկեք տեսեք,―պատասխանեց Բեորնը, և թզուկները հետևեցին նրան
segment_2283.wav|Դարպասի վրա ցցված էր գոբլինի գլուխը, հենց այդտեղ էլ, դարպասի ետևոմ, ծառից կախված էր գայլի մորթին
segment_2284.wav|Սարսափելի է Բեորնի պես թշնամի ունենալը
segment_2285.wav|Բայց նա հիմա իրենց բարեկամն էր, և Հենդալֆը մտածեց, որ ավելի լավ է անկեղծորեն նրան պատմել ամբողջ պատմությունն ու ճանապարհորդության նպատակը
segment_2286.wav|Ահա թե ինչ օգնություն խոստացավ Բեորնը
segment_2287.wav|Նա յուրաքանչյուր թզուկի պոնի կտարամադրի, իսկ Հենդալֆին՝ ձի, որպեսզի հասնեն մինչև անտառ
segment_2288.wav|Ճանապարհի համար մթերք կտա, որը խելացիորեն տնտեսելու դեպքում մի քանի շաբաթ կբավարարի
segment_2289.wav|Մթերքը թեթև կլինի և տեղափոխման համար հեշտ՝ ընկույզ, ալյուր, չորացած մրգով լի փակված սափորներ, մեղրով լցված կավե կճուճներ և հատուկ ձևով պատրաստված կեքսեր, որի մեջ սննդարար նյութերը շատ երկար են պահպանվում
segment_2290.wav|Այն պատրաստելու գաղտնիքը միայն Բեորնը գիտեր․ դրա բաղադրության մեջ մեղր կար, ինչպես որ նրա ամբողջ սննդի մեջ, և կեքսը համեղ էր, թեպետ ծարավ էր առաջացնում
segment_2291.wav|Նա նախազգուշացրեց, որ հետները ջուր վերցնել հարկավոր չէ, քանի որ մինչև անտառ ամբողջ ճանապարհին առվակներ ու աղբյուրներ կհանդիպեն
segment_2292.wav|― Բայց ճանապարհը Սև Անտառի միջով դժվար կլինի, վտանգներով լի և անծանոթ,― ասաց Բեորնը
segment_2293.wav|― Ոչ ջուր, ոչ էլ կեր այնտեղ չեք գտնի
segment_2294.wav|Ընկույզն այնտեղ դեռ չի հասել, իսկ ընկույզից բացի ուտելու պիտանի ոչինչ չի աճում
segment_2295.wav|Անտառի բոլոր կենդանի էակները վայրենի են, կատաղած և այլակերպ
segment_2296.wav|Ես ձեզ տկեր կտամ ջրի համար, նետեր ու աղեղներ, բայց չեմ
segment_2297.wav|Կարծում, թե Սև Անտառում որևէ հարմար որս կամ խմելու բան գտնվի
segment_2298.wav|Արահետը հատում է արագահոս Սև առուն
segment_2299.wav|Մտքներովդ չանցնի այնտեղ լողանալ կամ ջուր խմել․ ես լսել եմ, որ առուն կախարդված է և քուն ու մոռացկոտություն է բերում
segment_2300.wav|Չարժե թռչունների վրա կրակել, թե չէ, որսի ետևից ընկնելով, անտառի աղջամուղջում կարելի է արահետը կորցնել, իսկ դա ոչ մի դպքում չի կարելի անել
segment_2301.wav|Ահա իմ բոլոր խորհուրդները։ Անտառում արդեն ոչնչով չեմ կարող ձեզ օգնել, հույսներդ դրեք ձեր հաջողության վրա, սեփական քաջության և այն պաշարների վրա, որ ես դնում եմ ձեզ հետ
segment_2302.wav|Խնդրում եմ անտառի եզրից ետ ուղարկեք պոնիներին և ձիուն
segment_2303.wav|Հաջողություն եմ ցանկանում։ Իմ տան դուռը միշտ բաց է ձեզ համար, եթե պատահի այս ճանապրհով ետ դառնաք
segment_2304.wav|Նրանք, բնական է, շնորհակալություն հայտնեցին Բեորնին, բազմաթիվ խոնարհումներ արեցին, հատակը կնգուղներով ավլելով ու բազմիցս «պատրաստ ենք ձեզ ծառայելու, ով ընդարձակ փայտե դղյակների տեր» ասացին
segment_2305.wav|Բայց թզուկների սիրտը ճմլվում էր նրա չարագուշակ խոսքերից
segment_2306.wav|Վերջապես նրանց գիտակցությանը հասավ, որ իրենց ճանապրհորդությունն ավելի վտանգավոր է, քան պատկերացրել են և, եթե նույնիսկ բոլոր դժվարությունները հաղթահարեն, ճանապարհի վերջում վիշապն է իրենց սպասում
segment_2307.wav|Ամբողջ առավոտ ճանապարհի պատրաստություն էին տեսնում
segment_2308.wav|Կեսօրին վերջին անգամ Բեորնի հետ հաց կերան, հեծան ձիերը և, տանտիրոջը հարժեշտ տալով, դարպասից դուրս եկան
segment_2309.wav|Դուրս գալով Բեորնի բարձր ցանկապատով շրջափակված տիրույթից, նրանք ուղղություն վերցրին դեպի հյուսիս, իսկ հետո շրջվեցին հյուսիս֊արևմուտք
segment_2310.wav|Բեորնի խորհրդին հետևելով՝ նրանք թողեցին անտառային գլխավոր ճանապարհը, որ անցնում էր նրա տիրապետության հարավային սահմանով
segment_2311.wav|Բեորնը նրանց զգուշացրեց, որ այդ ճանապարհից հիմա ավելի շատ օգտվում են գոբլինները, իսկ ճանապարհը, ինչպես ինքը լսել է, արևելքում խիստ ծածկվել է բուսականությամբ և վերջանում է անանցանելի ճահիճներում
segment_2312.wav|Կարրոկից մի քանի օրվա ձիու ճանապարհ դեպի հյուսիս մի արահետ կա, շատ քչերին հայտնի, որը Սև Անտառի միջով դուրս է գալիս ուղիղ Մենավոր Լեռը
segment_2313.wav|― Գոբլինները,― եզրափակեց Բեորնը,― Կարրոկից և իմ տնից հարյուր մղոնից պակաս հեռավորության վրա գետը անցնել չեն համարձակվի․ գիշերը այն վատ չի պահպանվում
segment_2314.wav|Բայց ձեր տեղը լինեի, կշտապեի․ եթե նրանք հարձակումը շուտ սկսեն, ապա կհասցնեն հարավում գետն անցնել և կսանրեն անտառի ամբողջ այդ մասը, որպեսզի ձեր ճանապրհը փակեն
segment_2315.wav|Իսկ վարգերը, պետք է ասել, ավելի արագ են վազում, քան պոնիները
segment_2316.wav|Ուրեմն, արագ ճանապարհ ընկեք
segment_2317.wav|Նրանք սլանում էին լուռ, ոտքերի տակ ընտրելով փափուկ կամ խոտով ծածկված հողը
segment_2318.wav|Ձախից սևին էին տալիս լեռները, դիմացից մոտենում էին գետը եզերող ծառերը
segment_2319.wav|Արևը մինչև ուշ երեկո ոսկեզօծում էր մարգագետինները
segment_2320.wav|Դժվար էր ամբողջ ժամանակ հիշել գոբլինների ու հետապնդման մասին, և, մի քանի մղոն Բեորնի տնից հեռանալով, նրանք նորից սկսեցին շատախոսել, երգել ու դադարեցին առջևում իրենց սպասող անտառային մութ ճանապարհի մասին մտածել
segment_2321.wav|Երեկոյան, երբ մթնշաղը սկսեց իջնել և մայրամուտի շողերի մեջ փայլփլեցին լեռների գագաթները, ճանապարհորդները կանգ առան գիշերելու և պարեկներ նշանակեցին
segment_2322.wav|Բայց անհանգիտ քնեցին, և երազում գայլերի ոռնոց ու գոբլինների ճիչեր էին լսում
segment_2323.wav|Առավոտը լավ օր էր խոստանում։ Գետնին փռված էր սպիտակ մառախուղը, օդը զով էր, բայց շուտով արևելքում բաձրացավ կարմիր արևը, մշուշը ցրվեց, և ստվերները դեռ չէին հասցրել կարճանալ, երբ ուղևորները նորից ճանապարհ ընկան
segment_2324.wav|Նրանք արդեն երկու օր է գնում էին, բայց ոչինչ ու ոչ ոքի չէին տեսել, բացի խոտից ու ծաղիկներից, թռչուններից ու մենավոր ծառերից, մեկ֊մեկ էլ ազնիվ եղջերուներից, որ արածում կամ էլ ննջում էին պուրակների ստվերներում
segment_2325.wav|Երրորդ երեկոյան նրանք այնպես էին շտապում շուտով անտառի մուտքին հասնելու, որ մինչև գիշեր կանգ չառան և նույնիսկ որոշ ժամանակ էլ գնացին գիշերը, լուսնի լուսյով
segment_2326.wav|Աղջամուղջում Բիլբոյի աչքին մեկ ձախից, մեկ աջից մեծ արջի ուրվագիծ էր երևում, որ թաքնվելով շարժվում էր նույն ուղղությամբ
segment_2327.wav|Բայց երբ այդ մասին ասաց Հենդալֆին, նա միայն պատասխանեց․  ― Սը՜ս֊ս… Ուշադրություն մի՛ դարձրու…  Հաջորդ օրը նրանք դուրս եկան լուսաբացից առաջ
segment_2328.wav|Հենց որ լույսը բացվեց, նրանք տեսան անտառի սև, մռայլ պատը, որն ասես իրենց ընդառաջ էր գալիս կամ սպասում էր նրանց
segment_2329.wav|Ճանապարհը վեր բարձրացավ․ հոբիտին թվաց, թե լռությունը շրջապատում է իրենց
segment_2330.wav|Թռչունների ձայներն առավել հազվադեպ էին լսվում եղջերուներն անհե
segment_2331.wav|Տացան, նույնիսկ ճագարները կորան
segment_2332.wav|Կեսօրին նրանք հասան Սև Անտառի եզին և ձիերից իջան, որպեսզի հանգստանան առաջին ծառերի կախված ճյուղերի տակ
segment_2333.wav|Բները հաստ էին, կոշտուկավոր, ճյուղերը ծռմռված, տերևները երկար ու մուգ
segment_2334.wav|Բաղեղը փաթաթվել էր ծառերին ու տարածվել գետնին
segment_2335.wav|― Դե, ահա և Սև Անտառը,― ասաց Հենդալֆը
segment_2336.wav|― Հյուսիսային երկրում ամենամեծ անտառն է
segment_2337.wav|Ձեր կարծիքով ինչպիսի՞ն է։ Հիմա պետք է ետ ուղարկենք հրաշալի պոնիներին
segment_2338.wav|Թզուկներն անբավական քրթմնջացին, բայց Հենդալֆը խորհուրդ տվեց, որ ավելի շրջահայաց պահեն իրենց
segment_2339.wav|― Բեորնը այնքան էլ հեռու չէ, որքան դուք կարծում եք, և, առհասարակ, հարկավոր է խոստումը կատարել
segment_2340.wav|Բեորնը վտանգավոր թշնամի է
segment_2341.wav|Միստր Բեգինսի աչքերը ձերից լավն են․ նա վկա է, որ ամեն գիշեր մութն ընկնելուն պես մեր կողքին հայտնվում էր մեծ արջը կամ նստում էր քիչ հեռվում և լուսնի լույսով հետևում մեր ճամբարին
segment_2342.wav|Նա ոչ միայն պահպանում էր ձեզ և նայում՝ ճի՞շտ ենք գնում արդյոք, թե ոչ, այլև հետևում էր իր պոնիներին
segment_2343.wav|Բեորնը ձեր բարեկամն է, բայց իր կենդանիներին սիրում է հարազատ երեխաների պես
segment_2344.wav|Դուք նույնիսկ չեք պատկերացնում, թե նա ինչպիսի շնորհ արեց ձեզ, որ թույլատրեց իր պոնիներիով գնալ այդքան հեռու և այդքան արագ
segment_2345.wav|― Իսկ ձին ի՞նչ եք անելու,― հարցրեց Տորինը
segment_2346.wav|― Դուք, կարծեմ, չհիշատակեցիք, որ նրան ետ եք ուղարկում
segment_2347.wav|― Ես չեմ էլ ուղարկում։ ― Բա ձեր խոստումն ո՞ւր մնաց
segment_2348.wav|― Դա իմ գործն է։ Ես ձին ետ չեմ ուղարկում նրա համար, որ այդ ձիով ինքս եմ վերադառնում
segment_2349.wav|Այսպես, նրանք իմացան, որ Հենդալֆը մտադիր է իրենց լքել, թողնել Սև Անտառի բացատում, և հուսահատվեցին
segment_2350.wav|Բայց ինչքան համոզեցին, նա իր որոշումը չփոխեց
segment_2351.wav|― Այդ բոլորի մասին մենք պայմանավորվել ենք Կարրոկի մոտ,― առարկեց նա, վիճելն անիմաստ է։
segment_2352.wav|― Ինչպես արդեն ասել եմ, ինձ անհետաձգելի գործեր են սպասում հարավում
segment_2353.wav|Ես առանց այդ էլ ձեր պատճառով ուշանում եմ
segment_2354.wav|Կարող է պատահել մինչև արկածի վերջը դեռ հանդիպենք, կարող է պատահել և չհանդիպենք
segment_2355.wav|Դա կախված է նրանից, թե դուք որքանով հաջողակ, քաջ և հնարամիտ կլինեք
segment_2356.wav|Ես ձեզ հետ ուղարկում եմ միստր Բեգինսին, ախր մեկ անգամ չէ, որ ձեզ ասել եմ, թե նա այնքան էլ հասարակ չէ, ինչպես դուք եք կարծում
segment_2357.wav|Շուտով ինքներդ կհամոզվեք
segment_2358.wav|Այնպես որ մի՛ ընկճվիր, Բիլբո, հոնքերդ մի՛ կիտիր
segment_2359.wav|Մի՛ վհատվեք, Տորին և ընկերներ արշավը ինքներդ եք նախաձեռնել
segment_2360.wav|Շարունակ մտածեք գանձերի մասին, որ սպասում են ձեզ, և գլխներիցդ հանեք անտառն ու վիշապը
segment_2361.wav|Գոնե մինչև վաղը առավոտյան
segment_2362.wav|Առավոտյան նա նույնը կրկնեց
