filename|text
segment_2363.wav|Նրանք հարկադրված եղան տկերը ջուր լցնել անտառի ճիշտ մուտքի մոտ գտնվող զուլալ աղբյուրից և պոնիների թամբերը արձակել
segment_2364.wav|Բեռը նրանք հավասար բաժանեցին իրար մեջ, բայց Բիլբոն իր բաժինը անտանելի ծանր համարեց, նրան բոլորովին չէր ժպտում հակը շալակով շատ մղոններ քարշ տալու հեռանկարը
segment_2365.wav|― Մի՛ հուզվեք,― նրան մխիթարեց Տորինը
segment_2366.wav|― Հակը շուտ է թեթևանում, դեռ շատ կուզենաք, որ պարկերը ծանրանան, երբ մթերքը կսկսի վերջանալ
segment_2367.wav|Վերջապես նրանք հրաժեշտ տվեցին իրենց պոնիներին և նրանց գլուխները ուղղեցին տան կողմը
segment_2368.wav|Սրանք ուրախ տրտիգ տվին դեպի ետ, բացահայտորեն ուրախանալով, որ ետևում են թողնում Սև Անտառի խավարը
segment_2369.wav|Բիլբոն կարող էր երդվել, որ այն պահին, երբ պոնիները շուռ եկան դեպի տուն, անտառից դուրս եկավ մի մութ կերպարանք, որ նման էր արջի, և գնաց նրանց ետևից
segment_2370.wav|― Ցտեսություն,― ասաց Հենդալֆը Տորինին
segment_2371.wav|― Բոլորիդ, բոլորիդ ցտեսություն… Անտառով ուղիղ գնացեք, արահետից դուրս չգաք, թե չէ հազիվ թե նորից գտնեք և հազիվ թե Սև Անտառից դուրս գաք
segment_2372.wav|Այդ դեպքում ոչ ես, ոչ էլ ուրիշ մեկը ձեզ այլևս չի տեսնի
segment_2373.wav|― Պարտադի՞ր է, որ անտառով գնանք,― տնքաց հոբիտը, այո
segment_2374.wav|― Պարտադիր է…― կտրեց կախարդը
segment_2375.wav|― Կամ կգնաք անտառի միջով, կամ կհրաժարվեք գանձերից
segment_2376.wav|Ասենք հիմա չեմ էլ թույլ տա, որ դուք ետ դառնաք, միստր Բեգինս
segment_2377.wav|Ես ձեր փոխարենն ամաչում եմ։ Ինչպե՞ս կարող եք այդպիսի բան մտածել
segment_2378.wav|Այժմ դուք իմ առջև պատասխանատու եք բոլոր թզուկների համար
segment_2379.wav|― Ո՛չ, ո՛չ,― սկսեց արդարանալ Բիլբոն
segment_2380.wav|― Դուք ինձ ճիշտ չհասկացաք
segment_2381.wav|Ես ուզում էի ասել՝ շրջանցող ճանապարհ չկա՞ արդյոք
segment_2382.wav|― Կա, եթե ցանկություն ունես ավելորդ երկու հարյուր մղոն դեպի Հյուսիս քայլել, իսկ հետո էլ երկու անգամ ավել՝ դեպի Հարավ, ոչ
segment_2383.wav|Լավն այն է, որ բռնեք անտառի արահետը ու գնաք, տրամադրություններդ մի՛ գցեք, ապավինեք անտառին և, եթե ձեր բախտը բերի, գուցե և մի գեղեցիկ օր դուրս կգաք անտառից և առջևում կտեսնեք երկար ճահիճը, իսկ նրանից այն կողմ՝ Արևելքում բարձրացող Մենավոր Լեռը, որտեղ ապրում է ծերուկ Սմոգը
segment_2384.wav|Հույս ունենանք, որ նա ձեզ չի սպասում
segment_2385.wav|― Մխիթարեցիք, խոսք չկա,― փնթփնթաց Տորինը
segment_2386.wav|― Ցտեսությո՛ւն… Եթե չեք ուզում մեզ հետ գալ, ուրեմն ավելի լավ է գնացեք
segment_2387.wav|Վերջ խոսակցություններին…  ― Այդ դեպքում ցտեսություն և թող տեսակցությունը կայանա…― ասաց Հենդալֆը և, ձիու գլուխը շուռ տալով, գնաց դեպի Արևմուտք
segment_2388.wav|Բայց նա չէր կարող համբերել ու չասել ամենավերջին ողջերթի խոսքը նա շրջվեց
segment_2389.wav|ԵՎ ձեռքի ափերը դրեց բերանին․  ―Ցը֊տեսությո՜ւն, խնդրում եմ զգույշ ե֊ղե՛ք
segment_2390.wav|Ա֊րա֊հե֊տից դուրս չգա՜ք,― հազիվ լսեցին նրանք
segment_2391.wav|Ապա Հենդալֆը ձիուն բաց թողեց վարգով և տեսողությունից անհետացավ
segment_2392.wav|― Ցտեսությո՛ւն, ցտեսությո՛ւն, գնաս բարո՜վ,― փնթփնթացին թզուկները էլ ավելի ջղայնանալով այն բանից, որ Հենդալֆի մեկնումն իրենց սարսափելի վշտացրեց
segment_2393.wav|Ճանապարհորդության ամենավտանգավոր մասը դեռ առջևում էր
segment_2393.wav|Յուրաքանչյուրը շալակեց իր ծանր հակը ու ջրի տիկը, հետո շրջվեցին մեջքով դեպի արևը և մտան Սև Անտառ
