filename|text
segment_952.wav|Ես Դյուրինի շառավիղն եմ
segment_953.wav|― Ի՞նչ բան է Դյուրինի օր,― հետաքրքրվեց Էլրոնդը
segment_954.wav|― Ինչպես բոլորին պետք է հայտնի լինի, մենք Դյուրինի օր ենք անվանում այն օրը, երբ աշնան վերջին լուսինը և արևը միաժամանակ են լինում երկնքում
segment_955.wav|Վախենում եմ, որ այդ իմացությունը մեզ այնքան էլ չի օգնի, քանի որ մեր ժամանակներում կորսված է այդպիսի օրվա գալու ժամկետը հաշվելու կարողությունը
segment_956.wav|― Դա դեռ կտեսնենք,― միջամտեց Հենդալֆը
segment_957.wav|― Էլի որևէ բան գրվա՞ծ է
segment_958.wav|― Այսօրվա լուսնով այլևս ոչինչ վերլուծել հնարավոր չէ,― պատասխանեց Էլրոնդը և քարտեզը տվեց Տորինին
segment_959.wav|Դրանից հետո բոլորն իջան դեպի ջուրը, տեսնելու, թե ինչպես են երգում ու պարում էլֆերը
segment_960.wav|Իվանի օրվա առավոտն այնքան հրաշալի էր, որ միայն երազել կարելի է․ լազուր երկնքում ոչ մի ամպ, արևի շողերը պարում էին ջրի վրա
segment_961.wav|Ուղևորները ճանապարհ ընկան, նրանց ուղեկցում էին հրաժեշտի երգերն ու բարի մաղթանքները
segment_962.wav|Նրանք պատրաստ էին հետագա արկածների համար և հաստատ գիտեին ճանապարհը, որ Մառախլապատ Լեռների միջով իրենց դուրս էր բերելու լեռներից այն կողմ գտնվող երկիրը
